[
  {
    "date": "31/06/69",
    "time": "12:00",
    "sender_bank": "KBank",
    "sender_name": "นาย ทดสอบ ระบบ",
    "amount": "1,500.00",
    "receiver_name": "บริษัท เอบีซี จำกัด",
    "receiver_bank": "SCB",
    "memo": "ค่าบริการ",
    "remarks": "-"
  },
  {
    "date": "01/07/69",
    "time": "09:30",
    "sender_bank": "BBL",
    "sender_name": "นางสาว ใจดี ดีเสมอ",
    "amount": "500.00",
    "receiver_name": "นาย รักชาติ ยิ่งชีพ",
    "receiver_bank": "KTB",
    "memo": "คืนเงิน",
    "remarks": "-"
  }
]
